1,propongo sueo venda mate amarillo compro dia primavera banquemos arreglo auto carolina venezolana quedo trabajo protege mafia taxi

0,dia historico favor engaen ma dia gratis mira mira mejorentaxi taxiespaa gobierno vtc deleteuber consumo cabify defiendeespana estafacabifyuber licenciaurbanasi taxienlucha 1vtc30taxis felizjueves

0,critican presidente buscar hija auto ahi helicoptero acto oficial entrevistan pikietto expropio ciccone esconder boudou cfk usaba aviones llevar coima calafate completos

0,vergonzosa forma repitio historia contada cronica escrita redaccion cada medio realmente habia solo elemento constatado fatal

1,parece actores habia hoy manifestacion patronal vtcs pro cabify dado tiempo estudiar papel carteles hechos departamento marketing quedado chulos taxienlucha licenciaurbanasi

1,risa novio cuenta cuenta funciona siempre hago viajes bien checad

1,quinto

1,seora veronica cantando carretera perdida buitres siento auto tia

1,descuento eats codigo eats hhrdc4tfue

1,cabify necesitan ofertar servicios gratis disimular nefasta conduccion conductores nulo conocimiento calles enelfuturocabemostodos solo verdaderos profesionales quedaremos vivaeltaxi

1,pablo antillano gran tipo historia grande periodismo sueos venezuela siempre necesario ayudarlo hoy sumo

1,fascistada infecta interesa

1,escucha lukys93 cantando ahora que patito feo cover breaking

1,colombia mujer amante pidieron hotel chofer esposo

0,ayyy lindo quiero

0,imaginad toda tecnologia punta aplicada vehiculo autonomo conductor

0,siempre critican digo hicieron demasiado chongo dia van violar ahi va pen

1,hermano pablo enfermo batalla cancer costos tratamientos sobrepasan pido ayuda puedan hacerlo mil gracias

1,pensar chofer nia literal anda 80tera rolas inspiradoras

1,enelfururocabemostodos haciadondenosmovemos poderelegir cabify persona ma selecto salido exhaustivas pruebas licenciaurbanaya

0,caza fenomeno sindicalismo argentino

0,cada vez tomo paso cap pantalla datos chabon mama novio jaja nunca sa

0,veces

0,nuevo ataque quemacoches auto acusaron literalmente dejado calle medio laburo unico ingreso

1,manera ma facil rapida sentirte millonario chofer personal aqui voy asiento atras usando celular suave rato bajo toca manejar meterme trafico comer mierda

0,enelfuturocabemostodos taxienlucha nomasprecariedad importantes anuncios portavoz conductores vtc cabify rogamos paciencia video extenso detallista conceptos

1,200 000 peso puedes comprar aveo contado

1,llego propio uber decidia podium liberar nueva version ahora

0,pedo ahora darles pinch propinas

0,manda llegue tenes idea carajo toyota corolla

1,derecho trabajo obvio nadie niega hablamos de

1,empresa responsable aplicacion mostro interes cumplir requisitos legales tributarios

1,impiden mujer viaje perro guia chofer no gana via lucero marquez

1,chevrolet beat activ moderno divertido atractivo solo diseo exterior interior igual increible

1,tremenda sorpresa mujer amante piden buscar marido

1,tierno banderita colapso castellana acompaando 000 peseta ma solo grito solito aunque juntes sencillamente puedes vete jugar play taxienlucha enelfuturocabemostodos

0,viene tan lejos bebido agua colmo lleva bebe mira mira mejorentaxi taxiespaa gobierno vtc deleteuber consumo cabify defiendeespana estafacabifyuber licenciaurbanasi taxienlucha 1vtc30taxis felizmiercoles

1,voy dar consejo dejelos griten piten usted suba vidrios ponga musica cante feliz conductor dijo trafico creo aplica vida

1,derecho trabajo obvio na

1,tendencias iba motel amante conductor recogio esposo

0,pagara multa record 148 millones dolares filtracion datos

0,veces cabify

0,pedi seora limpia casa cuida hija vuelva casa vino conductora venezolana transaccion ma anti paro anti anti patriarcado anti chavista hice vida

1,movias

1,empresas cabify llevan toda riqueza mediante practicas elusion fiscal mientras precarizan trabajo uberizacion economia empobrece destruye derechos laborales trabajadores trabajadoras enelfuturonocabenbuitres

1,tambien taxi sitio dado tipo servicio siempre

1,tratara medios instale cordoba via

1,derecho trabajo

1,llego propio uber decidia podium liberar nueva version ahora algoritmo hace mejor en superior admite miedo algoritmos dan entrevistas todavia

0,hoy alguien subio cobraron viaje gente gandalla

1,sorpresa amor compadre

1,345 servidores baratos caen conductores baratos saben circular orientarse preocuparse tambien baratos cobrar servicios realizados cabify estafacabifyuber quejasvtc

0,van lograr simpatice bolu trabajaban bien epoca yegua puteaban dia ahora bancan malaria salen quemarle auto pobres tipos ma cagados hambre

1,derecho trabajo obvio nadie niega que

0,comanchera chismosa victoria amarga cabify

1,intencion demanda civil cabify plataformas tomen serio integridad usuarios cambien fondo mecanismos seguridad sealan abogados padre mara

1,neta meto app dia neta adiccion puedo dejar pedir ubers

0,influencers ustedes influencer papa conoce resulta chofer reconocio

0,felicidades mayoria conductores cabify dejado engaar farsa montada salvar chiringuito cuatro especuladores esperamos 2000 vtcs licenciaurbanasi taxienlucha

1,saliendo gym tomo wey reconoce twitter pide verga lanzamos motel darle duro rico  

0,derecho tra

0,pasa casi lados preguntan casada lista vestir santos

1,mujer pidio motel amante conductor esposo

0,alguien quiere ayudar carolina joven venezolana mafia taxi prendio fuego auto de

0,vendidos traidores firmais paripes promoveis manifestaciones esclavistas especuladores enelfuturonocabenbuitres taxienlucha

1,delicias cargadito delicias bares alma entraas

0,mafia volvio atacar choferes cabify

1,perfecto lados jueputa

0,pregunto casada olovorgooooo

1,duro

0,agradeceria siguiera

1,agendamundial espaa cabify protestan ley favor tradicional cdn

1,comparto ultimo video creado hermano conjunto en

1,cabron deseaba darse sentones verga verga dura queria ser ma culos demo duro see this and more

0,sabes tarifa dinamica ahora llegan tirando precios de tarjeta credito cuanto pase tiempo tendran ayuntamiento junta subir tarifas hacen minuto hojas reclamaciones

0,pedi idiota dando vueltas pendejo cancelara asi final hice

1,maria preguntamos duros pretende pre

1,amo nio dios

0,nueva sesion monotype reglas sleep clause item clause limite legendarios pokemon baneados blaziquen impulso groudoun kyogre etc decir

0,alguien quiere ayudar carolina joven venezolana mafia taxi prendio fuego auto cabify conducia tercero contacto avisen

1,hoy cambie mejor decision espero usuarios inconformes ha

0,remis legal cabify baleado dia miedo buscarme aeroparque sectores mafioso ver autoridades estan altura circunstancias

1,clima pago

0,conductor nego brindarle servicio mujer invidente acompaada perro guia mientras bajaba auto usuaria condeno accion denuncio discriminacion ser persona discapacidad

1,buenisimo

0,susto pedir llegaba

1,marcas agua empiezan regalar coches cabify botellas

0,pagara multa record 148 millones dolares filtracion datos ma millones usuarios

1,tio pablo cancer gran tipo admiro cualquier ayuda agradece

0,zasca toda boca acuerda pagar 148 millones dolares esconder robo masivo datos

0,nunca podido coincidir vainas

0,mierda

0,comparan venta ilegal sudanese calle pienso mira diferente cosa ahi levanta policia mujer prendieron fuego propiedad verdad mismo

0,tipos mediocres pelotudos tacheros votaron neoliberalismo quieren bancan competencia ademas brinda servicio mejor ma tobara juegan matones laburantes rugbiers anabolizados transporte

1,sanidad publica mayor tesoro resto servicios publicos mantienen impuestos puede parecer normal currantes autonomos empresas decentes paguemos religiosamente amazon ryanair enelfuturonocabenbuitres

1,cada hora medium servicio quieren ma autorizaciones denota realmente igual condiciones trabajador llevarse cada coche claro agua ugtestafa cabify enelfuturonocabenbuitres uberizacion

0,ami lee noticia primero comentar mujer tenia idea esposo trabaja

1,hola que significan cargo marcados vorden cuenta

0,puta realidad dia gratis colaboradores necesarios legalizar engao enelfuturocabemostodos ugtestafa taxienlucha veran medios

1,taxistas viven hoy mirar futuro comparado viene taxismo choferes toda persona preparacion superior destinada futuro vivir caridad publica menos eduquen bien hijos tendran futuro deseable

0,alanis estaria enamorada llevando

0,hola cabify por teneis sedes paraisos fiscales utilizais mecanismos ingenieria fiscal pagar menos impuestos espaa enelfuturonocabenbuitres

0,consumas cabify deliveroo globo airbub amazon economia colaborativa explotacion solo genus pobreza trabajadores sociedad juegan ventaja pagar impuestos enelfuturonocabenbuitres

1,ahora salio gratis carrera mujer pidio motel amante cond

1,padre mara castilla presentan denuncia cabify delito feminicidio

0,conmigo pasa solo hajo fine semana

0,diferencia ma taxienlucha vtc cabify huelga taxistas servicios minimos gratuitos dia gratis vtc parking currar enelfuturocabemostodos mejorentaxi

1,adelantando propina

1,ahora pese paro anunciado guatemala confirma dia hoy aplicacion contado socios conductores continuan atendiendo usuarios ningun momento visto afectado servicio

0,acuerdan fletada vida peda

1,hizo llegar mensaje viernes setiembre marcha lgbt descuento traslados hacia el

0,pedirles

0,puede ser podria ser digo asi pensarlo servicio gratuito ayer llego ser realidad recopilar datos usuarios direcciones nombres numeros tarjetas credito asi toda feisss

1,nojodaaaa barranquilla bella mujer pidio motel amante conductor

0,day 30daysongchallenge fito paez circo beat album completo 1994 via

1,buen beat

0,van tomar cartas asunto pasa raya gente laburo mafia taxi

0,pregunta cabify vtc dgt cuando ocurre accidente probabilidades aumentan segun dgt de

0,traficogt transitogt trabaron hoy huelga sexo jajaja

1,tiempo hija tio director cabify figura conductores firman contrato 12h dia dia semana hace casi 80h semanales ma doble permitido constituye delito seguridad trafico dgt vtc

1,acepta pagar 148 millones tratar ocultar brecha seguridad 2016

1,oye de verdad porqueria merece nota negra candela

0,grabacion conductor vtc denunciando estafa realizaron ayer aplicaciones cabify ofertando viajes gratis realidad timo manipulacion mediatica aqui realidad enelfuturocabemostodos ugtestafa

1,nojodaaaa barranquilla bella mujer pidio motel amante conductor esposo via

0,buenisima competencia ma europa aparte taxi empresa apoco van surgiendo ma

1,conductores cabify protestan madrid conductores cabify se

1,mujer amante pidieron hotel chofer esposo

1,ash hizo tarde amor veo llamale amigo guapo trae cree pueda llevarme trabajo

0,especial falta vlade asi

1,mucha sal

0,skip beat capitulo sub espaol live action via

1,envianos regalo cabify coca cola sigues multiplicando trayectos

0,teniamos haciamos autostop bebiamos agua fuentes mandaban comprar capaza gratis nio

1,empresas cabify deliveroo globo airbnb amazon quieren institucionalizar precariedad deber combatir modelo economico enelfuturonocabenbuitres

0,imagino facturas pone tributamos pais aqui dejo articulo abc un

0,vemos ma fondo situacion analizar esposo ocultaba trabajando 

0,protesta regulaciones cabify hoy llevaran ningun dinero holanda delaware

1,mirenlo lpm perfecto

0,humanos malos

0,culpa gobierno regularlo sacar partida evidentemente pueblo

1,pareja amantes pidio motel conductor esposo mujer tierra macondo puede suceder colombianadas 

1,acusaron consideran lenguaje territorio ideologia excelencia

0,tecnologia 148 millones multa tendra pagar ocultar hackeo noticias

0,definitivamente servicios sirven puede ser avisaron pobre mujer del

0,que une cabify deliveroo glovo airbnb amazon toda representantes nuevo modelo economico denominado uberizacion afecta forma directa relaciones laborales derechos trabajadoras trabajadores enelfuturonocabenbuitres

1,cabify cada persona energia cada barrio esencia cada ciudad luz totalmente laciudadestuya

1,cabify vienen ofrecer alternativas tampoco preocupan sostenibilidad movilidad ciudades vienen hacerte vida mejor sino sacar toda riqueza posible luego marcharse dejando miseria precariedad enelfuturonocabenbuitres

0,f foto llega

1,prefiero cabify laciudadestuya

0,safado

0,like nuevo logo branding

1,inminente inicio operaciones paraguay representantes firma recibidos viceministro fabian dominguez tema abordado marco tributario podria operar compaia pais sinvueltaspy 650am

1,continuum guerra taxistas choferes segundaedicion queremos saber opinion vos preferis

0,nia toco recien primera vez nanai sabia usar app

0,tranquilo sector sabe enelfuturonocabenbuitres

1,regular aplicaciones plataformas beat solo demuestran intento encuadrar entiende categorias aplican basura regulatoria

1,video amigos tal servicios pregunto mujer invidente discriminada obligada descender auto conductor podium viajar perro guia que opinan seguiran usando transporte discrimina

0,izquierda concentracion taxistas castellana derecha concentracion vtc cabify castellana hace falta decir ma enelfuturonocabenbuitres

0,f foto estrellas llega curul

0,voy tomar cuadras terror caminarlas sola miedo celular nunca ma vuelva casa miedo subirme sola cuadras ser mujer

0,frase maana cuanto ma entero ciertos taxistas queman agreden ma ganas sacar ma ma cuentas dan mafia dios mafia quieren justicia justicia barbaridad

0,amantes pidieron hotel chofer esposo

1,cabify multiplica trece demanda viajes motivo dia gratuito

1,ma cerca paraguay

0,dura clavo mirada morir tipo

1,avance modelo cabify sinonimo desposesion riquezas abajo precarizacion vida enelfuturonocabenbuitres

0,jajaja malas

0,aparte cabify entendido rompen ninguna ley

0,preguntate mismo choferes macho acosadores amiga

0,black querida

0,arjona existis

0,wao niunomas definitivamente servicios sirven puede ser

0,dedicado burro ignorantes defensores sepan estan defendiendo vendepatrias

1,cabron vivir miedo cada vez tomo minutos ma largo pasan muchas cosas po

0,que une uberizan economia saquean riqueza paises operan gracias casos estrategias elusion fiscal enelfuturonocabenbuitres precaricen futuro

1,quieres pagas quieres servicio tan bno barato siempre malo

1,hoyenanimal cabify gran medida culpa muerte hija confio supuesta seguridad ofrecian dice gabriela madre mara castilla

0,mientras taxistas honrados luchen limpiar oficio tanta lacra vivan

1,gusta paz tranquilo chupa hectareas huevos concha sindicalista hermana

1,mujer pidio motel conductor esposo juaaaaa

1,sueo vivir capital solo poder usar rappi glovo

1,joven ceguera acuso conductor nego darle servicio acompaada perro guia conductor dado baja anuncio empresa

1,cancun contara servicio eats

0,nomames trae pinche misa cristiana llevo medium hora escuchandola

0,oculta hackeo cuesta multa 148 millones

0,chingada banda cambium nombre cruz guadalupe refugio ambiguo

0,pida pet culera

0,asalariado explotados dicen empresa cabify etc proporcionado coches venir protestar dice conductor vtc fondo ugt blanqueando protesta supone defender gran capital trabajadores

1,acuerda pagar 148 millones ocultar hackeo masivo 2016

1,cs optan cabify gran banca amancio ortega florentino perez juan roig villar mir expertos solo pagar impuestos sino saquear cual problema pedro duque

0,tarea dificil ley subcontrato debe ser modificada sustancialmente puede ser constructora carpinteros banco cuente cajeros

1,taxistas lanzan denuncia masiva competencia dia gratis cabify

1,fakenews santa marta conductor recogio mujer amante un chisme sedujo medios

1,notomomastaxi tacheros ademas darle comer violento misogino baby etchecopar ahora queman coches laburantes quedan tacheros buenos vayan radio baby repudiarlo manifiesten caza silencio siempre complice

0,paises cabify conductores protestan contrario sucedido ayer trabajaron gratis hoy hicieron marcha jefes pierdan dinero invertido autorizaciones vtc enelfuturonocabenbuitres

0,chilango comento acento norteo parecia chistoso chiste cuenta solo

1,analizan insercion empresa paraguay representantes firma viceministro hablaron marco tributario podria operar compaia pais

0,despues quejareis cierran hospitales pagar pensiones etc

0,viajar pedir servicio quiere muuuy sencillo hace vola mejor buscar estacionamiento parquimetro viene viene asi mejor haz laciudadestuya cabify

1,hola dia equinoccio saque unas barras tenia baul recuerdos grabe video chulo ver mola erick herve beat

1,gracias gracias cabify gracias habeis permitido volver disfrutar dia conduccion segura duda enelfuturocabemostodos vosotros cabemos ma comodos amb licenciaurbanasi taxienlucha

0,este sabado casa vacas primer festival humor feminista estaran

0,caza destruyeron auto almagro quemaron medio trabajo

1,actitud seorita roci feliz juebebes tome maneje mejor siga tomando pida

0,diverso

1,toda clase conductores siquiera dejan bajar vidrios

0,eats chihuahua hace falta categoria bolas arroz

0,chofer aplicacion nego prestar servicio debido joven acompaada perro asistencia cree conductor debe recibir castigo cree derecho negarse hacer viaje

0,regreso casa recogio puso trayecto musiquita hector lavoe felicidad

0,cielo tierra oculto tarde temprano sabe

0,huelga taxistas bloquear ciudades huelga vtc llevar gratis pasajeros acabo coger cabify

0,noma dicen ven pago sabes espera jaaajajajajajaa

1,empresas pueden deben simplemente lavarse manos padre mara castilla demandan cabify responsabilidad feminicidio joven

0,diria gran ggm mariposa amarillas

1,enelfuturonocabenbuitres hace cabify conductores gracias ma horas trabajando peligro volante taxienlucha

1,amo colombia amo

1,recuerden chico trabajo ojala algun dia pueda llevarlos arrepentiras bien servicio

1,padre mara castilla demandan cabify responsabilidad feminicidio joven

0,mala hemeroteca programita sacara verdad

1,caricomorg fightncds stepitup vocradio

0,distancia destinos descarga app iniciatuviaje

1,santa marta

0,caza destruyeron cinco auto quemaron medio trabajo via

0,juju tiro pedo cabify chabon abrio ventana

0,necesito ayuda cuenta intentar pedir aparece ups error error ha

0,ahhhh bueeeeno

0,lite pesa alrededor 5mb equivalente tres selfies tiempo respuesta promedio obtener viaje tan solo 300 milisegundos literalmente parpadeo

1,argentinos super indignados ataque auto cabify manejaba chica venezolana mientras

0,despues queman

0,tipo noble taxista caza voto macri

1,cabify demandado mexico presunta responsabilidad homicidio 2017 joven puebla

1,jajajajajajajajajajajajajajajajajajajajajajajajjaajajajajajajajajajajajajajajajajaajajajajajajajajajajajajajajajaja

1,taxistas anti funcionando mafioso viste votados votantes iguales

1,low cost cadenas farmacias funciona mundo aca problema argentino medio aora barro mierda especie religion miedo progreso paralizante hombre mate mano

0,hoy casi baja golpes carro reporte seguramente hara respecto mini

1,analizan insercion paraguay tras reunion representantes viceministro set

1,mujer ceguera denuncia discriminacion parte conductor

0,dicen malechores

0,saludo despidio super cortante esperar queda dia

0,difundamos favor

0,este sabado casa vacas primer festival humor feminista estaran degustando placeres jhana beat festivalcoumor

1,super reconocimiento esperan entres casa

0,megusta insultar laspersonas aun termino lacarrera espero algun

0,violacion inminente

1,hace viajaba piden pasar ma atras subieran pasajeros

0,destruyen cinco coches buenos aire amenaza

1,chofer colorin seor lado mio bus tambien hoy dia suerte

1,conductor niega servicio mujer llevar perro guia ma detalles noticias

1,pagara multa historica 148 mdd filtracion datos

0,pronto veremos manifestaciones conductores pequeos empresarios vtc unica premisa cabify ponen euro

1,vea cogido nueva york bangkok pasando ma ciudades emblem

0,repito llaman mafia taxi tenes pruebas mal generalizar tomar enfermito

1,beat cual plan tripioso

0,2019 venga maeeee quiere pago parece viene rodillas

0,derecho tomar ma lograron siento taxistas ver ataque taxistas caza quemaron auto almagro villa crespo flores

1,usando cabify ademas contribuir perpetuar pobreza contribuyes destruir cualquier cosa ver publico empresas extractivas solo fin enriquecerse cualquier precio enelfuturonocabenbuitres taxienlucha

0,siempre aportais nuevo salvo explotacion evasion fiscal good bye cabify

1,clientes internacionales humphreys amp arch sido seleccionado finalista diseo termin

1,sabes depende veces veces cabify ma barato jajaja

1,ranchito uber gran oportunidad empleo muchos

1,ver salen mamadas tambien

0,alguien pregunta estan trabajadores construccion ahora ven obras mire vtc cabify parece gran salida despues crisis edad entrar construccion saludablemente inviable

1,cazauber prendieron fuego auto mina laburar cabify representaba unica fuente ingreso nena puta vida volvere subirme

1,upnred recorri calleque puede pasarme aunque sola 00am escucho pasos ire ma rapidopido uber

0,mandalo goma perro vale ma coche

1,jjjjaaa alexis benites0pedro aguayo

1,insultes pide ningun papel choferes presentan ningun papel trucho fin

0,hoy casi baja golpes carro reporte seguramente hara respecto minimo que

1,futuro quieren especuladores enelfuturonocabenbuitres

1,pedir calle casa forma proteccion

1,parece bueno proyecto manera legislar creo actitud cobarde pegar afiches anonimos repudio tipo amenaza

1,querooooo

1,avanza proyecto regular apps ayer comision asuntos constitucionales dio luz verde proyecto iniciativa popular confirmando mismo conforme respeta constitucion caba ahora necesitamos 000 firmas

1,quisiers presupuesto golpe frente cofre beat 2019 comobq doblo ollito

0,destruyen cinco vehiculos buenos aire amenaza

1,cortemos mafia

1,nuevo decreto secretaria cultura 2019 banana duro banana banana tieso banana banana perverso banana banana travieso banana banana chiquito banana banana sabroso banana banana sweet banana banana nice banana banana beat    

0,antecedente seguramente servira demandar igual manera

1,eduardo garcia aos dice hace me durmiendo calle ahora trabaja cabify dieron oportunidad ahora vivo habitacion alquilada

0,invertira millones dolares movilidad sostenible

1,haganme recordar viaje ma bondi pacheco proxima

1,yuririasierra presenta trabajo historia lucero mujer debilidad visual

0,ustedes quejan momentos incomodos

1,eelive angel medinilla empresas adaptan buscan leyes proteger negocios ca

1,rebasa esperan nuevo chevrolet beat activ siguetubeat

1,escuela incendiada moreno remise legales quemados anti habra castigo

0,cabify

1,rebasa esperan chevrolet beat activ siguetubeat

0,mama acordo despues do semanas existia parte unica sola gasto la

0,aumento pobreza sigan hablando caza

1,paso camiones saldre mejor gastar jajajaj

0,defendia taxistas canse prepotencia soberbia violencia ningun monopolio saludable les asusta tener competir mejorar servicio too bad votaron neoliberalismo libertad mercado pues vino darselos

1,amantes pidieron hotel descubren chofer esposo com

1,doctora blasey ford recuerda episodio juez nominado trump intento violar redes sociales conservadoras responden linchandola asco

1,ciudad buenos aire ciudad asegura organizaciones detras ataques auto uber

0,turista suizo asaltado llegar hotel taxista trajo aereopuerto tomado estaria

0,escuela incendiada moreno remise legales quemados anti habra castigo habra gallina habra huevos

1,amantes pidieron hotel descubren chofer esposo siempre digo dios escribe estilo ricardo arjona

0,pensamiento jodidos que pedo subieron persona sigue gritando recorran atras

1,el ultimo the daily gracias cibersegur

0,ojo

1,mama joven eda siiiip aqui esquina

1,buena onda chofer dejo cambiar llegar tarde trabajo juevesdetetasseductoras seductorasteam

1,evasion fiscal empresas cabify toda riqueza obtenida extranjero mientras sucede espaa trabajadores empobrecen pierden derechos laborales denunciamos uberizacion economia enelfuturonocabenbuitres

0,persona mismas conmigo iba ma cerca resolvio casi 200 un

0,nuevo ataque caza almagro encargada auto incendiado hablo madre soltera vengo venezuela hace do me trabajo cabify totalmente legal ahora dejaron laburo hacen taxistas amenazan sacan fotos

1,sumamos taxistas cazauber pesada herencia dejara pro porteos

1,queda claro dije cierto

0,votos ao pre electoral

1,estan anti detras ataques quemacoches tres auto incendiados caba almagro escribieron encargada dijo vehiculo habilitado plataforma cabify denuncio taxista saco fotos

1,querian conocer regimen impositivo responde fabian dominguez viceministro set intenciones instalarse paraguay dijo metanle paguen impuestos

1,cabify confirma pedido 000 vtc madrid niega especulacion enelfuturonocabenbuitres

1,noche pondremos puro power beat rolas electronicas sonidos potentes ruidosos esperamos 9pm en

1,circulaenredes video mujer debilidad visual denuncia chofer tras negarle servicio llevar perro guia malahiuber

1,generalizan hablan mafia taxi tienen pruebas saben mafia total

0,sienten facundo analisis politico pidanle ponganlo mute

1,momento debatir seriamente mejoramos experiencia movernos ciudad evolucion presentamos propuesta

0,hablando telefono natalia wilaaaa compre perico cremas

0,multa millonaria ocultar robo masivo datos

1,playlist llamada alabanzas redentor ayuda

1,conviertes chofer dejas man casa novia

1,asi funciona berlin taxi ubers dentro misma aplicacion mismas reglas usuario puede elegir beneficios plataforma segura moderna importar servicio use

0,hacer pasa esperan muerto legislen diputados terminen violencia me quede trabajo voy hacer drama maria carolina victimas caza

0,cuento chimbo costeo solicitar foto celular nombre conductor placa tipo vehiculo

0,real jajajajaja mientras esperas rumbo rivadavia brazil

1,segui bancando mafia taxi pelotudo

1,rendi duda beat delicia album

