1,hacen super pendejos conductores didi preguntan doy joven pendejo

1,conductor dijo acento parecido la latina modern family

1,mano aaaaaaa

0,pais justicia ma lenta mundo aca medios solo dia investiga toma pruebas juzga condena maana publicidad ilegal guita tirar techo pueden hacer publicidad legal piratas

1,uso cabify pet super agusto subes traen cubierto asiento

1,mujer pidio motel amante conductor esposo noticiasdlp

1,pagara conductores ma viajes uberpool lyft

1,ma casos vamos podemos revertir aun quilombo

0,mentira dio cuenta nonbre apellido siempre pido pasan datos chofer

0,hora enteron planchandome cabello empiece llovisnar cancele pinch min ajuera

0,jaja claro digo moderno tiempos

1,hoy medio cumpli fantasia queria asi sigue pie fantasia jajaja hoy pedi que

0,barba tattoo carpintero tambien pinta parrillero remis jajajajaja

0,hola quisiera saber existe opcion pool aparece

1,jajaja vip

0,aplicacion alpedo nunca use nunca voy usar salgo ajajjajajaj

0,arjona so vos

0,ahora entiendo taxistas estan necesito version arjona

0,necesito recuperar bolsa olvide responde nadie

1,gobierno comenzo enfocado quitar trabajos persiguiendo los

1,mujer amante

0,estupidas tarifas elevadas

0,ilegal paguen impuestos boludos

1,estrellas

1,hola edison favor contactanos boton ayuda aplicacion medio de

1,mafia seria ilegal evade impuestos laburantes tacheros

1,bolsominion convencendo votar bolsonaro kkkkkkkkkkkkk

1,hace par dia hombre hotel amante mujer limpiaba habitaciones suegra compite cabeza cabeza historia

0,descargo

0,ay mama

0,pregunta mama marian cero estrellas valorar juventud

1,gustado video chofer santo domingo

1,gusta asi

0,facil licencias ciudad lidia

0,dije cogiera shortcut casa dijo muertos bitch

1,demorando

0,pienso medio comunicacion nacional deberia hacer ningun tipo publicid

0,amiga acelere dice

1,peste pasto carro

0,mala suerte jaaaa

0,huele pipi gato seguire informando

1,river pidiendo

0,uffff suerte robo amiga

0,condena primera vez taxista agredir chofer

1,mando

0,puede operar segun ley todabia podes seguir usando gracias

0,insulto taxista responder insulto saco arma apunto ver policia al

0,preguntan por gusta hablar choferes cabify hoy porfio no

0,chofer pudo resistir vergon sube porno blog chacalovers network

0,digo tono despectivo democratico vehiculos choferes particular

0,puedo checar aclaracion cobraron viaje completo cancelado tambien cobraron cancelacion

1,conductor tratando ligarme

0,dijo sam puede fallar

0,hora presionar mejore largue ma mucha gente apoyo entraron abusos estan ganando salida

0,salen datos chofer pedis pidio marido mirar

0,veinte minutos esperando cancele

1,jajodeeeeee

0,creo acabo enamorar

1,trae playlist luis miguel mil estrellas usted seor

0,larreta todavia ma zurdo lousteau

0,averigua impuestos hace inminente arribo paraguay

1,pudiera tener suerte xdxd

0,jajajajajajajajaj bizarro

0,preguntan por gusta hablar choferes cabify hoy porfio vivia comuna santiago vivia cerca uoa

0,poca madre cobrar 5usd cancelacion viaje persona tenia llevarme nunca lle

0,vida aqui cobertura

1,parece dejado pagar mariscadasrecio medios de informacion partir hora empezaremos ver tipo noticias declara 3420 millones holanda pagar menos impuestos

1,amor ma muerto carrera chofer

1,colombia pidio auto hotel alojamiento amante chofer marido

0,weyyy emocion mejor amiga carro personal gratis

0,terroristas mato cinco argentinos york chofer

0,tecnologia aplicacion averigua impuestos hace inminente arribo paraguay via

0,same amaria crossover javier fernandez creado choferes

0,tecnologia lyft pasa delante igualdad genero noticias

0,sale currently unavailable eats hace dia pedi naan amp curry hoy puedooo

1,ganas elecciones concha lora pelado mierda

0,hoy necesito comida solo sale disponible taco bell kfc pizza hoy eats

1,baja precios favor usuarios tambien deberia exigir

0,cabron vuelve frenar luz amarilla pego tiro jurao

1,hp carros gente hace ahora miniaturas hatchback parte carroceria jueputa

1,aplicacion reconocimientos viene paciencia viajar caos

0,caraca

1,wow miedo legal

1,conductores lyft visto caer ingresos

1,mujer amante piden motel aparece marido conductor

1,mujer colombia pide amante pasa buscar esposo

1,paraguay tributacion considera llegada inminente sumara fuentes trabajo empleo formal poblacion empresa opera 650 ciudades paises mundo

1,iria dependiendo tienda quede ma cerca vehiculo aunque ahora ma facil

0,lleva puros corridos pensar secuestrar ponerme cantar chevesuki

1,mujer pidio motel amante conductor resulto ser

0,mejor tomate capaz volves vos nena

1,casa fiesta brunch cine vayas vayas fin semana vamos junto cabify codigo sepfin18 obten viajes dscto amigo tambien obtengan muevete rapido horas codigo desaparecera

0,ajajjaajaj jajajajajajaja nooo

0,aqui parque viva 000

1,corazon 

1,miedoo primer viaje sola

0,repartidor trajo cena eats traia hijo cute cagado decia que

0,tanta vaina ser chofer

0,empeze cantar mientras venia paso remix farsante dije gusta super

1,dios bendiga conductores seores buen pedo ven hija asi sup

1,doy cuenta tambien pague madrugada  

0,novio enorgullecen americano es deporte ma jugado mexico dicen primero

0,ma caida aba cantv

0,harias che contame

0,dan agua dulces decian drogaban chicas se

0,600pesos

0,democratico tema

1,debio ser viaje incomodo

1,acabo subir ma hermoso mundo trae perrito demasiado lindo quiero abrazarlo

0,viva

1,whatsapp facebook twitter snapchat instagram sin limite

1,drogandome parte mil

0,comprese carro pida

1,luis escuchando partido luis tener estrellas aca muera

0,vio foto marido manda foto chofer

1,comenta

1,hola vero olvidate objeto ultimo viaje ingresa inicia

0,primero diga puedo hacer

0,lleva minutos diciendo llega 5min

1,actualidad destacada declara holanda ingresos 420 millones tributar menos

0,top story lanza nuevo sistema respuestas inteligentes uberchat see more

1,usuarios suben maruchan tragan galletas pan deja

0,intelligenius lanza nuevo sistema respuestas inteligentes uberchat see more

0,voy perrito omg

0,diferentes tipos servicio pet mascotas assist persona discapacidad embarazadas tercera edad seor cuestion falto etica profesionalismo tratar situacion

0,pregunta sampaoli alguien pasa buscar toma

0,preso deberia

0,razon maestro tomese saquese alianzas

0,ahorita contando seor van 512 asesinados nicaragua momento pense wtff noo esto

1,historia criticando iba cambiando velocidades manejo me

1,dan agua dulces decian drogaban chicas bajan abrir puerta inter robado vehiculos reciben viajes solo llevan sitios dodne asaltan confirma identidad usuario

0,gustas lesbianas novia lesbiana bisexual que pensarias bisexual novia ay

1,mejor eats pedido orlando hamburger mac and cheese bacon

0,tenes toda razon tomate sacate alianzas dudas

0,multa millonaria ocultar robo masivo datos via

1,tuits chileno tambien van publicar

1,hoy tome florida center creo conductor encontro cara perdida pregunto

1,hoy literal volvi nacer quisieron asaltar avenida mae ahi entendio pasaba

0,imbecil perros asistentes persona debiles visuales pueden viajar ha

0,hola buenas noches carlos visto mucha polemica respeto chofer no

1,solicitar deje efecto cobro efectivo resolver problema

0,damos cuenta taxistas malos portan mal servicio

1,consegui primer viaje gratis usando codigo vj0rbx codigosuber promouber 2730627223356701

0,importa vayas viaja utiliza promo code globalmedia obten descuentos viajes

0,enterate piden levantar sospechas nunca imaginaron chofer seria marido muj

1,tecnologia apuesta mejorar seguridad usuarios conductores

0,condenaron taxista caza agredio gomera remisero intento justificarse

0,cabrones fin parte chacal casado obviamente taparle cara comenten seores parecen facil hacer video voy agarrando practica jeje

0,camino motel mujer infiel amante llevan sorpresa chofer inesperado sucedio una

1,jajajja punto ma vez

0,condenado pagarle asistente acusa elusion fiscal cemento armado

0,contigo comparto tiempo gasolina verte minutos mientras convertia amo

1,mujer amante pidieron paso recoger marido

0,mierda hacen tocarles persona asi tocan ma pairas lym

1,vida tuit

1,fin alguien entiende alguien cerebro tal maniobras de

0,buenas noches consulta pide aplicacion dice monto cancelar chofer

0,hijueputa congojon bateria puede terminar viaje

0,asfshahevajajajajja

0,sigo insistiendo necesitan hacer registro tipo

0,parte chacal machito cabron platica continuum segunda vez veo cabron

0,cabrones vuelto andamos nuevamente gracias dios cabron chacal parece gay hecho gay casado escuchen dice puso bien cachondo cabron coger hace semanas cabrones quieren continuacion

0,jaja

0,gran mala cuea pobre weon

1,viste jorgito malo taxistas cambio muchachos buenos

1,despide chofer despues haber negado servicio mujer ceguera

1,voy man gusta resto adrenalina cualquier cosa gusto conocerlos

0,hoy dia do frases famosas aque dice vuelvo coger muerta ganadora do zas toda boca luego bye bye adios cabify ganadora premio fin dejo ser esclavo

0,camino motel mujer infiel amante llevan sorpresa chofer inesperado sucedio mujer aparentemente infiel decidio encontrarse lugar publico amante posteriormente irse junto un

1,amantes piden motel llega volante esposo engaado via

0,pff tambien problemas llegar encuentros

0,lapoliticaonline larreta endurece leyes mientras lousteau busca regular servicio

1,dia mierda viene perrita gracias daisy alegrar dia tan basura tqm

1,perefiero taxi cumplen ley empeze mo cumplir ley

0,pega asiento atras

0,gato

0,hoy solicite hermana cuada pesima experiencia conductor re

1,dicen taxi blancos deberian mejorar servicio quite trabajo

0,extrao eats

1,morras guapas suben pool padre inunden humilde transporte privado belleza pero

1,pidio moteliar conductor termino siendo marido microcuentos

0,medio quede dormida violaron suerte

0,tenes razon fer tomate deja alianzas casa capo trata

0,algoooo malooo aaaa malooooooooo

0,tiembla tiembla tiembla omsa

1,cuantas mina hecho multi millonarios dueos moteles

0,pensaba tenia mal dia

1,trajeeeee

0,chavo venia platicando envenenaron gatito empezo cortar voz ganas llorar bien triste

0,tenes razon capo decile viaja alianzas trata cuenta del

0,solo pasaria arjona

1,conductores cabify manifiestan castellana

1,siento miedo dormirme

0,rompi tweet favs

0,cancelar servicio despues 5min haber aceptado convertido alla voy

1,verdad mira hace aos estan hacen cosas ojo tomas

1,ojala finalmente autoridades den entrada pronto plataformas digitales transporte cabify andale etc destino increible pagar servicio taxi extremadamente caro ineficiente

0,pidan manga giles

1,disculpa canciones geis ustedes culpa ofrecerme bluetooth

0,puto eats acepta tarjeta jijodesuperra

0,le habra puesto estrellas

0,uhh garca denunciarlo anotense taxista argentinos brasil devolvio una

0,bueno bueno mafia taxi taxistas malos claro choferes de

0,nombre puede decir comun super facil llego seor decirme adan 

1,hace largaaa

0,pongo estrellitas conductor pone

1,toco habla cada segundo ma borde ataque goma debo ser

0,hoy primera vez vida casa ride camioneta habia camiones sent super vatillo

1,genial chavos rappi eats novias acompaen trabajar

0,mafia taxi taxistas malos claro choferes tr

1,digo luz tablero significa trae puesto freno mano

0,ahora patrullas familiares operadores policias

1,jajajaja

0,wa gonna tip the eats driver lleva minutos ma decia

1,flojera nivel quiero oxxo cerca casa eats

0,que gente prefiere montarse tipo mal aseado chandal vueltas robarte coche sucio viejo puedo creer

1,cada voy salir voy regresar mieo idea

1,jajajajaja cuabdo dijo llevaban boliche pense dimelo wachooo

1,tenes razon sinverguenzas patoteros ladrones hace aos estan ya

1,amigo secuestre

0,hice maleta pedi

0,serio

0,realidad supera

0,luego quejan quita trabajo

0,dia quise bailar warhol sent burn disfraza joven ademas dio do

1,siempre hablan ataques salvajes taxistas conductores cabify aclaran pero cabify legal atacar gente propiedad ilegal bueno vaya pase

1,dijo gracias guero

0,hora venganza impuestos cooperativas taxi

1,daft punk playlist automaticamente estrellas

1,jajajajajaja tramposa

0,tenes razon mierda tacheros tendrian ser asi vez prender

0,pide

1,trae cancion fav fav fav regeton mundo blessedaf encantadora slp

0,pedo contigo pides compartido asume inconvenientes

1,coo iba imaginar pediria cachapa eats

0,esperando sol pibitos mierda literalmente aos estan pidiendo numero hace

0,tenes suerte esconderte

1,quitaron pool

0,cosa torpe uber

0,pague viene san carlos

0,estrellas tip rojo

0,seguro viejo veces ofrece caramelos mejor servicio

1,feo novia llamar telefono mientras miedo pase sociedad mierda

0,aer por queres recoja tenes amantes ahi verdad por eng

1,che dicen delincuentes mira boby

0,llevo ma do horas esperando baje precio

0,vuelvo lok

1,cosas pasan

1,aun esperando jiji esperate do horitas

0,tenia chingo ofrecian botella agua mil estrellas propina chingao

1,venimos casa babe dando masajito pie bebes amor entonces tan perfecto

0,taxistas solo barcelona pagamos impuestos cosas aparte inventas sanidad educacion infraestructuras pensiones cosa cabify dia hoy demostrado hacerlo parece saludo

1,comunidades ayuntamientos podran limitar licencias cabify

1,mujer amante piden saber chofer esposo mujer debe letra vallenato

0,platica tampoco hace pedo escuche musica quiere pero

0,tenes razon estercita mejor servicio trata usar alianzas tomas

1,resulto fan platanito show

0,cobrara recargo demoras pasajeros deberian regular tambien demoras conductores minutos ser exactos

0,contare chisme mejor amigo reto capaz trabajar asi acabe descargar

0,cuidado mejor tomar colectivo

0,hola quieren ver video amigo primera experiencia single solo habiamos experimentado chicas despues dio curiosidad asi denle subirlo completo 

0,ahora entiendo gente dice ladron acaban cobrar 200 carrera hice salio horror tratando poner reclamos app deja

0,chiguire bipolar nadie

0,traia antologia version nortea asi feeling sonora pueblo magico

0,mexico magico

0,gustas lesbianas novia lesbiana bisexual que pensarias bisexual novia pues corto pues bisexual

0,trae cloud nine kygo gano estrellas corazon

0,hola bebes estudiante hijos discreta caliente estrecha disponible hoy hacienda cascada algun hotel manda pasas 1100xhora citas 816833403 solo whatsapp llamadas

1,hola bebes valeria estudiante uni aos hijos discreta caliente estrecha disponible maana 10am 7pm 1100xhora manda pasas solamente centro citas 8116833403 solo whatsapp

0,entiendo gente sube carro subidos dan cuenta tomo foto

1,ahora hackean cuentas

1,pequeo mundo mujer pidio motel amante conductor esposo

0,solo perro pasa poncha llanta mitad camino

0,veo bastante dormida f realidad pensas choferes ube

1,jajajajaja ligar familia

1,llevo hora medium pinche cuenton pinche trafico culero

0,aun responden

0,cantando creo ma actitud viernes

0,tipica amiga siempre invita medio mundo shot comida helados putas invitan

1,manejado rapido siento cualquier momento vomito

0,buenas noches duda caido pago semana cerro banco ningun

0,ansiedad genus ver recorrido cabify buscar favorrrrr

0,figuro fiesta disfraces disfraz yuhu

0,glo desafortunadamente beat bueno sabemos ilegal igual igual

1,caso lucero negaron servicio llevar perro guia detalles

0,chofer trae rolitas antro asi siento emocionalmente estable

1,historia debe ser ma falsa pides aparecen datos conductor vehiculo

0,parezco alv

1,argentina caza gran mayoria rechaza

1,presenta nueva aplicacion movil

0,lanza nuevo sistema respuestas inteligentes uberchat acaba presen

1,segui pelotudo va ahorrar alianzas jajjajjaaj

0,casal

0,historia creer el colmo mala suerte

1,tenia auxiliar regresamos

1,entonces usamos corruptos ofrece mejor servicio taxistas au

0,dahoris

0,tambien nunca ma

0,choca subirme huela pedo siento bajo huelo eso

1,hoy llegue atrasada trabajo gracias chofer pesimo hoy

1,elusion fiscal como condenaron mile euro multa eludir pagar seguridad social empleado cosa

1,acaba decir mato do persona auidaaaa

1,pagara 148 millones dolares ocultar robo masivo datos 2016

0,me quieran ver cara tonta van vine veces cabrones

0,bueno empeza tomar deja alianzas casa linda trata cuenta del

0,entiendo gente sube carro subidos dan cuenta verifico las

1,moratorium gobierno cabify cuatro noticias economicas maana via

0,maana despertare super temprano llegar tiempo trabajo pedo pienso pagar 200 peso

1,taxistas principales promotores

0,saca piedra pregunta para vamos viejo men pues direccion

1,chofi dice molesta subo musica libro camino escuchar musica yendo po

1,colombia trayectos cuentan poliza responsabilidad civil emitida asegurado

1,pan dios evadan impuestos quieran mientras tan noble

1,ayuntamientos podran imponer horarios tarifas cabify via

0,chofi dice molesta subo musica lindo camino escuchar musica yendo po

0,momento random dia seran consciente seores restaurantes asi atienden gordas tipo sabran estan atendiendo amores ma persona serum normal tipo doa maria jose daniela llevo

1,seor vengo bailando what like about you culpa ponerla deje juzgarme

1,nuevo emprendimiento carreti

0,oiste

0,preparense pendejos taxistas mierda aguantarse tecnologia siglo ira cr

0,vieja pendeja nota solo tenia ganas hacerla pedo existe pet ademas cuantos perros

0,conductor malas agresivo manejar despues cuenta venia escuchando partido de

0,pan dios paguen impuestos quieran mientras tan noble

1,gran noticia pagara 148 millones dolares resolver denuncias relacionadas violacion datos gran escala expuso informacion personal ma millones usuarios unidos informo miercoles fiscal general iowa

0,acabo salir currar centro casa andando min vine seor quedo espera

0,creen chorritos van robar jajaja csm 

1,jajajajajaja mierda

0,mala suerte empardo

0,mentira santa marta

1,hombre trabajan taco bell carro compaias grandes ppdmandatuira

1,enterate ahora puede seguro ningun lado amantes piden hotel chofer esposo implicada temiroymeimaginoque felizfinde buenviernes humor

0,viejo quiere vaya cuida jajaja mangueo plata voy pata modos

0,quiza suene feo ocasiones odio conductor pro hablar

0,mandando boletos carlos rivera pidelos whatsapp tel 46169044 tintanisimo az

1,birra ma dentro

1,perdiste

1,denominados caza quemaron cinco automoviles denominados caza quemaron cinco automoviles

0,vez mamadas

1,cuanto estigma hacia bisexualidad tuit

0,hablando gran hermano monton

1,llego tubergon

0,tenes razon tom deja alianzas casa trata cuenta chofer

1,denunciara penalmente luego 24septiembre operadores negara serv

0,apoco victoria

0,estan invitando cojer verdad ganas solamente pagan ahre

1,pinche trafico asqueroso ojala mueras salir bien caro

1,uso diario bien mejor conductor sabe la

0,tampoco puedo solicita pool mande inconformidad aplicacion nadie responde

1,agarrar viernes quincena

0,favor ayuda urgente padre actividad complementa ingresos mensuales bloquearon cuenta tan solo actualizar foto perfil sistema automatizado fallo rechazo solo quiero sometan nueva revision cero

0,hoy placer transportarla hablamos camino cara ojos dan gus

0,historia ma falsa

0,tendria tener parte conductores digan gusta charlar despues pueda fil

1,subieron persona sigue gritando recorran atras siento enojado

1,navegador voz pito quiero bajar

0,estimado mario resolvio

1,denunciara penalmente luego 24septiembre operadores negara servicio persona ciega acompaada perroguia

1,hoy deseo buena suerte amor dios escuche

1,conflicto vtc quiero dar gracias clientes cabify apoyo prestado semana

1,hoy

1,cayo bach cero estrellas

1,claves decreto lio fomento regular cabify informa

0,serum politico serum ratero pegara mujeres serum narco rapist asesino serial alcoholico drogadicto comprara musica grupo hash trabajara televisa serum huevon mantenida serum super puta sextuitera pensar decidir abortolegalya

1,mentira solicitas siempre muestra conduce placas carro chevere noticiasmvs

0,pues solo queria ver reaccion realmente sorprendido jajaja

0,taxistas entiende queremos

1,jajaja puede echar desm dentro carro merecen estrellas

0,jajajajajaja

0,aweo os

1,cuanto baje borro tweet trayecto

1,chofer tiene viene prendido escuchando bidi bidi bam bam selena

0,cabify legales mejor enfoquense mejorar servicio reclamar menos regulaciones impuestos atacando competencia logran asi funciona mercado taxi estan muriendo adaptense desaparezcan

1,dignidad acabo pedir dejen timar bajarme coger caracteriza aos vejez

0,chacal en caso seria chacalon que consejo dan como ligarian ustedes

0,puto robo tupper

1,ojala

0,curiosidades pidio escaparse amante chofer resulto ser esposo barranquilla

1,harta juro sacar ma fuerzas afrontar maltrato falta respeto hacia mujer mierda creen manga hijos puta acosan calle acosan colectivo acosan remise taxi boliches

0,toco turrito encima canta3

0,shale dinero irme alvvvv

0,siempre chingo aguitas ver alguna coloca creo puro mame rumor

1,amantes piden motel llega volante esposo engaado aah jajajajajajajajaaaaaaa

1,real cabify aceptan tarjeta wtf varado polanco

1,muestre madera hecho asqueroso

1,varado polanco cabify aceptan bbva

0,prudente pedir lugar tres minutos

1,venezuelatriunfaenlaonu lidera10 felizfinde moruy periodistas nacional jose altuve chavez maduro

0,borre aplicacion hace uso

1,mayor miedo mka 

0,premiaba

0,quiere dar facturas pedi ocasiones ma twitter me

0,bueno pues subrayado partes considerado ma jugosas condiciones uso por dios senor usuari den aceptar haber leido enelfuturonocabenbuitres

1,comision asuntos constitucionales dio luz verde proyecto regular apps caba presentado conjuntamente ahora debemos juntar 000 firmas legislatura trate proyecto camara iniciativapopular

1,acabo viajar chabon habia gran hermano increible hablaba

0,dije podium apresurar creo penso ref

0,ultimo mala racha

0,nunca llego paso tiempo cancelara

0,added video playlist amantes pidieron chofer esposo

0,amantes pidieron chofer esposo

0,karaparaask taxi gratis turquia

0,pasa bordo aunque solo difundan noticias desprest

0,entramos nico chanta dice hola chico bienvenidos jajajajajajajajaja daniel enrique caballero

0,canciones acabo escuchar deberia haber cobrado viaje recien

1,cool puso twenty one pilot

1,conoce morelia jalador

0,ser chiste ciudad solo tres carros do esten descansando

0,choca eats viene bici

1,llevo min tratando salir casa limitantemente caro tampoco cabify me

1,jajajaajja pulso jajajaja

0,servicio tan chafa minutos esperando conductor ma

0,aqui mexico pongo podcast dicen quitalo alv pon maluma

1,gusto video cuanto dinero gana lyft comparacion oscar alejandro

0,subi borracho conductor miro culo pidio bajara

0,erga jajaja beta

0,titular arjona hace tema

1,elfa mami pidiendo esther mija llego plateado elfa mamaaaa bmw quisieras

1,peso cada vez pendejo conductor mete calle lado real necesit

1,richard regalo viaje gratis 500 clp acceder regalo registrate enlace

0,aca arriba

1,tomar dinamica malo tomar dinamica chofer pare hocico malo tomar

1,super cool 

1,toco super rifado valio madre inundacion trajo bien hogar

0,alguien quiera mandarme botella vino rappi eats

0,pido black 

0,repitio cancion veces pedo

0,tomar dinamica malo tomar dinamica chofer pare hocico malo tomar dinamica chofer pare hocico intenta vender amway matenme verga

1,llevo min tratando salir casa impermisiblemente caro tampoco cabify ya

0,agarren prometo ahi veran ambulanfes peso quieren

0,hablando hna ser menos conversador tierra pobre hombre

1,diosito lluvia noma bajarme plis

0,recope plagada corrupcion dejaron trabajar brilla oro

1,maana mano comentamos via libre ciudades invaliden mile licencias cabify via

1,filtros destino vuelve viajes dia lyft

1,cada acto parte taxistas dan ma ganas seguir usando

0,quieras caminar pide

1,comienza investigacion violacion seguridad 2016

1,hola bien guapo jajajajajsd

1,fin cabify adopta estrategia activa informativa iniciativa viajes gratis sido forma publicidad fantastica reaccion taxistas apoya propuestas abogados sacaperras competencia desleal competencia bravo

0,jajajajakajakajaakakakjakakajajaajaja

0,maldita llama salados

1,tiro flojera aqui estacionado walmart mientras pasajera compra pisto ojala invite

0,infinity war mejor crossover hoy llego carro taxista

0,pues volvi usar

1,lite llega mexico

1,podre seguir utilizando cabify tras traspaso competencias ccaa

1,fulano sospecharia metio pezcarla fraganti

1,pisteando camino jajajaja

1,garchada

1,aegentina pais increible rompe toda teorias economicas existentes krugman aca estarian manejando

1,persona afectada debe evitar llegar algun acuerdo reparatorio evitar que

1,casi subo verguenza dignidad

0,nojoda eats ponen logica ubicacion mojonzaso trae comida ll

0,dale mandame buscarme casa depositame lucas ahora paso cbu

0,es normal enamorarse choferes

0,verdad equivocan cobran no 

1,mejor chicas servicios puebla 100 recomendable responsable

0,socio borracho compra quilombo centurion

1,verga punto decirle seor carro manejar verga man ma lento torpe

1,que prefieres local aqui video respecto comment comment4comment

0,alguien conoce taxista gay

1,nomames casi mata   pase horas arreglandome estupido llegar sola pieza

0,send nude quieran

0,oso uber 

1,da cuenta eats respalda barrio

0,amo loco puede ser tan copados fumer porro

0,victimas inseguridad implica utilizar transporte publico ilegal buenos aire taxienlucha

0,vianey dice suba escuchar pensamientos

1,hoy use cabify primera vez toco viejo desagradable dijo mejor iba pie habia marc

0,creo gasto ma plata cosa

1,siempre vivo nubes

1,que fuerte 

1,prensa orlando mujer colombia pide amante pasa buscar esp

0,hombre ignorante

0,entonces cualquier persona puede poner volante coche identificado reconocido po

1,papa

0,dan millas aviones reclamo

